species,title_abstract,species_corrected,hosts_corrected,infection_site,infection_site_parenthesized,infection_site_not_in_text,parenthesized_not_in_text,infection_site_corrected,parenthesized_corrected
Pleistophora cephei,"Eight New Microsporidian Parasites of Moss-Mites (Oribatei, Acarina) in Forest Soils. Four new species of the genus Pleistophora (P. oribatei, P. cephei, P. platynothri, and P. dindali), one of Thelohania (Th. microtritiae), and three of Nosema (N. steganacari, N. acari, and N. führeri) are discovered and described from mossmites (Oribatei, Acarina) in forest soil samples from Lower Saxony and Hessen (Federal Republic of Germany). Acht neue Mikrosporidien‐Arten aus Hornmilben (Oribatei, Acarina) aus Waldböden Im Rahmen einer vergleichenden Bodentieruntersuchung wurden in verschiedenen Waldstandorten Niedersachsens und Hessens 62 Hornmilbenarten festgestellt, von denen 12 Arten mit Mikrosporidien infiziert waren. Diese gehören acht verschiedenen Species an, die hier als neue Arten beschrieben werden: Pleistophora oribatei n. sp. in verschiedenen Hornmilbenarten; P. cephei n. sp. in Cepheus dentatus Michael (Cepheidae); P. platynothri n. sp. in Platynothrus peltifer C. L. Koch (Camisiidae); P. dindali n. sp. in Carabodes coriaceus C. L. Koch (Carabodidae); Thelohania microtritiae n. sp. in Microtritia minima Berlese (Euphtiracaridae); Nosema steganacari n. sp. in Steganacarus striculus C. L. Koch (Phtiracaridae); N. acari n. sp. in Damaeus onustus C. L. Koch and D. clavipes Hermann (Damaeidae), und N. führeri n. sp. in Phtiracarus globosus C. L. Koch (Phtiracaridae). Der nachgewiesene Mikrosporidienbefall betrug bei den meisten Wirtsarten 2–5%, nur bei Rhysotritia duplicata Grandjean (Euphtiracaridae) lag er bei 15% und M. minima 10%.",Pleistophora cephei,Cepheus dentatus,gut-wall,NA,gut-wall,NA,NA,NA
Pleistophora dindali,"Eight New Microsporidian Parasites of Moss-Mites (Oribatei, Acarina) in Forest Soils. Four new species of the genus Pleistophora (P. oribatei, P. cephei, P. platynothri, and P. dindali), one of Thelohania (Th. microtritiae), and three of Nosema (N. steganacari, N. acari, and N. führeri) are discovered and described from mossmites (Oribatei, Acarina) in forest soil samples from Lower Saxony and Hessen (Federal Republic of Germany). Acht neue Mikrosporidien‐Arten aus Hornmilben (Oribatei, Acarina) aus Waldböden Im Rahmen einer vergleichenden Bodentieruntersuchung wurden in verschiedenen Waldstandorten Niedersachsens und Hessens 62 Hornmilbenarten festgestellt, von denen 12 Arten mit Mikrosporidien infiziert waren. Diese gehören acht verschiedenen Species an, die hier als neue Arten beschrieben werden: Pleistophora oribatei n. sp. in verschiedenen Hornmilbenarten; P. cephei n. sp. in Cepheus dentatus Michael (Cepheidae); P. platynothri n. sp. in Platynothrus peltifer C. L. Koch (Camisiidae); P. dindali n. sp. in Carabodes coriaceus C. L. Koch (Carabodidae); Thelohania microtritiae n. sp. in Microtritia minima Berlese (Euphtiracaridae); Nosema steganacari n. sp. in Steganacarus striculus C. L. Koch (Phtiracaridae); N. acari n. sp. in Damaeus onustus C. L. Koch and D. clavipes Hermann (Damaeidae), und N. führeri n. sp. in Phtiracarus globosus C. L. Koch (Phtiracaridae). Der nachgewiesene Mikrosporidienbefall betrug bei den meisten Wirtsarten 2–5%, nur bei Rhysotritia duplicata Grandjean (Euphtiracaridae) lag er bei 15% und M. minima 10%.",Pleistophora dindali,Carabodes coriaceus,gut-wall,NA,gut-wall,NA,NA,NA
Pleistophora finisterrensis,"Pleistophora finisterrensis n. sp., a microsporidian parasite of blue whiting Micromesistius poutassou. Pleistophora finisterrensis n. sp. is a microsporidian parasite of the hypoaxial musculature of the blue whiting Micromesistius poutassou (Risso). Foci of infection are between 3 and 6 mm in length and have no evident effects on adjacent muscle fibres. We found only a single type of spore (uninucleate, with mean dimensions of 4 x 2 μm in fresh preparations), contained within sporophorous vesicles (mean diameter 19 μm in fresh preparations; 150-250 spores per vesicle). All of the development stages of this microsporidian are monokaryotic. The meronts are initially uninucleate and bounded by a plasmalemma. Towards the end of merogony, meronts are multinucleate plasmodia with a well-defined surface coat. Sporogony is polysporous, with multinucleate sporonts, which likewise have a well-defined surface coat (about 130 nm thick), dividing by plasmotomy to give rise to uninucleate sporoblasts. The polar tube is isofilar and consists of 8-9 turns in the posterior half of spore. The polaroplast is made up of an anterior lamellar part and a posterior vesicular part.",Pleistophora finisterrensis,Micromesistius poutassou,hypoaxial muscles,NA,hypoaxial muscles,NA,hypoaxial musculature,NA
Pleistophora oncoperae,"Pleistophora oncoperae sp.n. (Protozoa: Microsporida) from Oncopera alboguttata (Lepidoptera: Hepialidae) in Australia. Pleistophora oncoperae sp.n. is described from adults and larvae of Oncopera alboguttata and O. rufobrunnea. The main site of infection was muscle, though fat body and connective tissue were also infected. Fresh pansporoblasts measured about 25 μm in diameter and contained 16 to 32 or more spores with a mean size of 5.9 × 3.1 μm. Macrospores measuring 7.7 × 4.4 μm were also seen. The mean polar filament length was 158 μm; ultrastructural studies showed that the filament is normally arranged in 14 coils (range, 13 to 20) at an angle of 53.5° to the axis of the spore. The species was found to be distinct from all previously described Pleistophora reported from Lepidoptera.",Pleistophora oncoperae,Oncopera alboguttata; Oncopera rufobrunnea,muscles; fat body; connective tissues,NA,muscles; connective tissues,NA,"muscle (Oncopera alboguttata, Oncopera rufobrunnea); connective tissue (Oncopera alboguttata, Oncopera rufobrunnea); fat body (Oncopera alboguttata, Oncopera rufobrunnea) ",NA
Pleistophora oribatei,"Eight New Microsporidian Parasites of Moss-Mites (Oribatei, Acarina) in Forest Soils. Four new species of the genus Pleistophora (P. oribatei, P. cephei, P. platynothri, and P. dindali), one of Thelohania (Th. microtritiae), and three of Nosema (N. steganacari, N. acari, and N. führeri) are discovered and described from mossmites (Oribatei, Acarina) in forest soil samples from Lower Saxony and Hessen (Federal Republic of Germany). Acht neue Mikrosporidien‐Arten aus Hornmilben (Oribatei, Acarina) aus Waldböden Im Rahmen einer vergleichenden Bodentieruntersuchung wurden in verschiedenen Waldstandorten Niedersachsens und Hessens 62 Hornmilbenarten festgestellt, von denen 12 Arten mit Mikrosporidien infiziert waren. Diese gehören acht verschiedenen Species an, die hier als neue Arten beschrieben werden: Pleistophora oribatei n. sp. in verschiedenen Hornmilbenarten; P. cephei n. sp. in Cepheus dentatus Michael (Cepheidae); P. platynothri n. sp. in Platynothrus peltifer C. L. Koch (Camisiidae); P. dindali n. sp. in Carabodes coriaceus C. L. Koch (Carabodidae); Thelohania microtritiae n. sp. in Microtritia minima Berlese (Euphtiracaridae); Nosema steganacari n. sp. in Steganacarus striculus C. L. Koch (Phtiracaridae); N. acari n. sp. in Damaeus onustus C. L. Koch and D. clavipes Hermann (Damaeidae), und N. führeri n. sp. in Phtiracarus globosus C. L. Koch (Phtiracaridae). Der nachgewiesene Mikrosporidienbefall betrug bei den meisten Wirtsarten 2–5%, nur bei Rhysotritia duplicata Grandjean (Euphtiracaridae) lag er bei 15% und M. minima 10%.",Pleistophora oribatei,Rhysotritia duplicata; Microtritia minima; Damaeus clavipes,lymphocytes; oenocytes; gonads; gut-wall,Microtritia minima; Microtritia minima; Phtiracarus sp.; Damaeus clavipes,lymphocytes; oenocytes; gonads; gut-wall,Phtiracarus sp.; Damaeus clavipes,NA,NA
Pleistophora platynothri,"Eight New Microsporidian Parasites of Moss-Mites (Oribatei, Acarina) in Forest Soils. Four new species of the genus Pleistophora (P. oribatei, P. cephei, P. platynothri, and P. dindali), one of Thelohania (Th. microtritiae), and three of Nosema (N. steganacari, N. acari, and N. führeri) are discovered and described from mossmites (Oribatei, Acarina) in forest soil samples from Lower Saxony and Hessen (Federal Republic of Germany). Acht neue Mikrosporidien‐Arten aus Hornmilben (Oribatei, Acarina) aus Waldböden Im Rahmen einer vergleichenden Bodentieruntersuchung wurden in verschiedenen Waldstandorten Niedersachsens und Hessens 62 Hornmilbenarten festgestellt, von denen 12 Arten mit Mikrosporidien infiziert waren. Diese gehören acht verschiedenen Species an, die hier als neue Arten beschrieben werden: Pleistophora oribatei n. sp. in verschiedenen Hornmilbenarten; P. cephei n. sp. in Cepheus dentatus Michael (Cepheidae); P. platynothri n. sp. in Platynothrus peltifer C. L. Koch (Camisiidae); P. dindali n. sp. in Carabodes coriaceus C. L. Koch (Carabodidae); Thelohania microtritiae n. sp. in Microtritia minima Berlese (Euphtiracaridae); Nosema steganacari n. sp. in Steganacarus striculus C. L. Koch (Phtiracaridae); N. acari n. sp. in Damaeus onustus C. L. Koch and D. clavipes Hermann (Damaeidae), und N. führeri n. sp. in Phtiracarus globosus C. L. Koch (Phtiracaridae). Der nachgewiesene Mikrosporidienbefall betrug bei den meisten Wirtsarten 2–5%, nur bei Rhysotritia duplicata Grandjean (Euphtiracaridae) lag er bei 15% und M. minima 10%.",Pleistophora platynothri,Platynothrus peltifer,gut-wall,NA,gut-wall,NA,NA,NA
Pleistophora senegalensis,"Ultrastructure and development of Pleistophora senegalensis sp. nov. (Protozoa, Microspora) from the gilt-head sea bream, Sparus aurata L. (Teleost, Sparidae) from the coast of Senegal. The microsporidian Pleistophora senegalensis sp. nov. parasitizes the gilt‐head sea bream, Sparus aurata L, The parasite is found in the intestinal wall where it forms small xenomas in the muscularis. The development cycle of this species is described by light and electron microscopy. Meronts are rounded plasmodia dividing by plasmotomy and bounded by an amorphous and very regular wall. At the onset of sporogony, sporophorous vesicles are formed by separation of the plasma membrane from the external wall which then becomes a characteristic mesh. Mature spores (4.45 × 2.37μm) are ovoid and slightly pyriform with a large posterior vacuole.",Pleistophora senegalensis,Sparus aurata,intestines,NA,intestines,NA,intestinal wall; muscularis,NA
Pleistophora sp. 10,"Tissue specificities of Thelohania duorara, Agmasoma penaei, and Pleistophora sp., microsporidian parasites of pink shrimp, Penaeus duorarum",Pleistophora sp.,Penaeus duorarum,muscles,striated muscles,muscles,striated muscles,NA,NA
Polydispyrenia norandina,"MICROSPORA (PROTOZOA) EN SIMULIIDAE Y ULTRAESTRUCTURA DE POLYDISPYRENIA SIMULII Y POLYDISPYRENIA SP. NOV. PARASITOS EN SIMULIDOS DE LOS ANDES COLOMBIANOS. We describe the ultrastructure of two microsporidia parasites of simuliids of the region of La Calera (2.950 m alt.), near Bogotá. Polydispyrenia simulii was found infecting larvae of Simulium ignescens and Polydispyrenia norandina sp. nov., infecting a larva of Gigantodax ortizi. The two species present large number of spores aggregated within a sporophoric vesicle, characteristic of the family Pleistophoridae. Polydispyrenia simulii, a cosmopolitan parasite of simuliid larvae, has until now been the only known species of this genus. Two ultrastructural characters permit identification of this species: a) Presence of peculiar cylindrical structures surrounding the sporoblasts in the cavity of the sporophoric vesicle (episporontal space); in cross section these structures look like thick-walled rings: b) Consistently 5-6 coils of the polar filament inside the mature spore. Polydispyrenia norandina sp. nov.shows metabolic products within the episporontal space that appear as electrodense spots and 8 coils of the polar filament, both in the sporoblasts and in the mature spores.",Polydispyrenia norandina,Gigantodax ortizi,Adipose,NA,Adipose,NA,NA,NA
Potaspora aequidens,"Potaspora aequidens n. sp. (Microsporidia, Tetramicridae), a parasite infecting the freshwater fish Aequidens plagiozonatus (Teleostei, Cichlidae) from Brazil. Morphological and molecular procedures were used to describe a new species of microsporidian that infects the muscles of the sub-opercular region and the caudal fins of the freshwater Aequidens plagiozonatus in Brazil. This microsporidian forms whitish xenomas containing variable number of spores, reaching up to ~0.4 mm in diameter. The mature spores, pyriformin shape, with slightly round ends, measured 3.4 ± 0.5 μm long and 1.9 ± 0.3 μm wide (n = 50) and showed characteristics typical of Microsporidia. The average thickness of the spore wall was 100 (96–108) nm (n = 50), and the spore wall was composed of two layers, a thin, electron-dense exospore and a thick electron-transparent endospore. The exospore was surrounded by a thin, irregular layer of granular material. The anchoring disc was mushroom-like, located in the apical region of the spore in an eccentric position relative to the spore axis, rendering bilateral asymmetry to the spore. The anterior part of the polar filament (PF) (manubrium) measured approximately 125 (122–128) nm thick (n = 30), and the angle of tilt between the anterior PF and the spore axis was ~45°; the posterior part was packed in 8–9 coils. Phylogenetic analysis showed a strongly supported clade containing family Spragueidae Weissenberg, 1976, family Tetramicridae Matthews and Matthews, 1980, Microsporidium sp. RBS1, and Kabatana spp. In conclusion, the available morphological, ultrastructural, and molecular data shows that this microsporidian is a new species belonging to group 4, classified as Potaspora aequidens n. sp. This is the second species described in the genus Potaspora.",Potaspora aequidens,Aequidens plagiozonatus,fins; skeletal muscles,NA,skeletal muscles,NA,muscles,NA
Potaspora macrobrachium,"A new microsporidium, Potaspora macrobrachium n.sp. infecting the musculature of pond-reared oriental river prawn Macrobrachium nipponense (Decapoda: Palaemonidae). This paper described a novel microsporidian infection in the pond-reared oriental river prawn Macrobrachium nipponense. A conspicuous symptom of the infection was progressive white opacity associated with the musculature. Although neither bacteria nor viruses were detected in routine diagnostic tests, apparently degenerated microsporidian cells or spores were frequently observed in wet smears of the musculature from diseased prawns. Histological observations also revealed characteristics typical of microsporidian infection throughout the host. Transmission electron microscopy revealed multiple life stages of a microsporidian parasite within the cytoplasm of host muscle cells. In addition, partial small subunit ribosomal RNA (SSU rRNA) gene was obtained by a nested PCR using microsporidian specific primers. A consensus sequence was then deposited in GenBank (accession no. KU307278) and subjected to a general BLASTn search that yielded hits only for microsporidian sequence records. Phylogenetic analysis showed that the isolate was most similar to the fish microsporidian clade containing the genera Kabatana, Microgemma, Potaspora, Spraguea, and Teramicra. The highest sequence identity, 87%, was with Potaspora spp. Based on histological, ultrastructure and molecular phylogenetic data, we erected a new species, Potaspora macrobrachium for the novel microsporidium. The description of microsporidium in this important commercial host was fundamental for future consideration of factors affecting stock health and sustainability.",Potaspora macrobrachium,Macrobrachium nipponense,skeletal muscles; cardiac muscles,NA,skeletal muscles; cardiac muscles,NA,musculature,NA
Potaspora morhaphis,"A new microsporidian parasite, Potaspora morhaphis n. gen., n. sp. (Microsporidia) infecting the Teleostean fish, Potamorhaphis guianensis from the River Amazon. Morphological, ultrastructural and molecular characterization. SUMMARY A fish-infecting Microsporidia Potaspora morhaphis n. gen., n. sp. found adherent to the wall of the coelomic cavity of the freshwater fish, Potamorhaphis guianensis, from lower Amazon River is described, based on light microscope and ultrastructural characteristics. This microsporidian forms whitish xenomas distinguished by the numerous filiform and anastomosed microvilli. The xenoma was completely filled by several developmental stages. In all of these stages, the nuclei are monokaryotic and develop in direct contact with host cell cytoplasm. The merogonial plasmodium divides by binary fission and the disporoblastic pyriform spores of sporont origin measure 2·8±0·3×1·5±0·2 μm. In mature spores the polar filament was arranged into 9–10 coils in 2 layers. The polaroplast had 2 distinct regions around the manubrium and an electron-dense globule was observed. The small subunit, intergenic space and partial large subunit rRNA gene were sequenced and maximum parsimony analysis placed the microsporidian described here in the clade that includes the genera Kabatana, Microgemma, Spraguea and Tetramicra. The ultrastructural morphology of the xenoma, and the developmental stages including the spores of this microsporidian parasite, as well as the phylogenetic analysis, suggest the erection of a new genus and species.",Potaspora morhaphis,Potamorhaphis guianensis,intestinal,NA,intestinal,NA,coelomic cavity,NA
Pseudokabatana alburnus,"Pseudokabatana alburnus n. gen. n. sp., (Microsporidia) from the liver of topmouth culter Culter alburnus (Actinopterygii, Cyprinidae) from China. We describe the type species of a novel genus of microsporidian parasite, Pseudokabatana alburnus n. gen. n. sp., infecting the liver of topmouth culter, Culter alburnus Basilewsky, 1855, from Lake Poyang off Xingzi county, Jiangxi Province, China. The parasite elicits formation of spherical xenomas of up to 1.2 mm in diameter containing all observed life stages from early merogonal plasmodia to mature spores contained within the cytoplasm of host hepatocytes. Merogonal plasmodia existed in direct contact with the host cytoplasm and contained up to 20 visible nuclei. Plasmotomy of the multinucleate plasmodium led to formation of uninucleate cells in which the nucleus underwent further division to form bi-nucleate presporonts, sporonts (defined by cells with a thickened endospore) and eventually sporoblasts (containing pre-cursors of the spore extrusion apparatus). Mature spores were pyriform and monokaryotic, measuring 2.3 ± 0.19 μm long and 1.3 ± 0.10 μm wide. Spores possessed a bipartite polaroplast and 5–6 coils of a polar filament, in a single rank. The obtained partial SSU rRNA gene sequence, 1383 bp in length, did not match any of microsporidia available in GenBank. SSU rDNA-based phylogenetic analysis indicated a new taxon branching with Kabatana rondoni, a parasite infecting the skeletal muscle of Gymnorhamphichthys rondoni from the Amazon River. Due to different host and tissue tropism, the novel taxon did not fit the diagnostic criteria for the genus Kabatana. Further, based on SSU rDNA-inferred phylogenetic analyses, different ultrastructural features of developmental stages, and ecological considerations, a new genus Pseudokabatana and type species Pseudokabatana alburnus n. sp. was erected for the parasite in topmouth culter.",Pseudokabatana alburnus,Culter alburnus,Hepatocytes of Liver,NA,Hepatocytes of Liver,NA,liver,NA
Pulicispora xenopsyllae,"The microsporidium Pulicispora xenopsyllae gen. n., sp. n. trom fleas of the genus Xenopsylla. P. 13-19.. The ultrastructure of the polysporous microsporidium Pulicispora xenopsyllae gen. п., sp. n. from Xenopsylla fleas is studied. Stages of late rnerogony and sporogony are limited by the amorphous, then double—layered coat of sporoforous vesicle. There is one type of sporogony. In the beginning of sporogony there is diplocarya. Sporophorous vesicles contain 8 to 32 spores. Oval-cylindrical spores have one horseshoe-shaped nucleus, large lamellar polaroplast and anisofilar polar tube. The number of thick and thin coiles of the tube is different: 5+3.5 , 6+3.5 , 7+3 . Sizes of spores are 5.7X2.8 mkm (from X. skrjabini) and 4.6X3.0 mkm (from X. Hirtipes).",Pulicispora xenopsyllae,Xenopsylla skrjabini; Xenopsylla hirtipes,fatty body; muscles; hypodermis; then other organs,NA,fatty body; muscles; hypodermis; then other organs,NA,NA,NA
Rugispora istanbulensis,"Description and phylogeny of a new microsporidium from the elm leaf beetle, Xanthogaleruca luteola Muller, 1766 (Coleoptera: Chrysomelidae). This study describes a new genus and species of microsporidia which is a pathogen of the elm leaf beetle, Xanthogaleruca luteola Muller, 1776 (Coleoptera: Chrysomelidae). The beetles were collected from Istanbul in Turkey. All developmental stages are uninucleate and in direct contact with the host cell cytoplasm. Giemsa-stained mature spores are oval in shape and measured 3.40 ± 0.37 μm in length and 1.63 ± 0.20 μm in width. These uninucleate spores have an isofilar polar filament with 11 turns. The spore wall was trilaminar (75 to 115 nm) with a rugose, electron-dense exospore (34 to 45 nm) and a thickened, electron-lucent endospore (65 to 80 nm) overlaying the plasmalemma. Morphological, ultrastructural, and molecular features indicate that the described microsporidium is dissimilar to all known microsporidian taxa and confirm that it has different taxonomic characters than other microsporidia infecting X. luteola and is named here as Rugispora istanbulensis n. gen., n. sp.",Rugispora istanbulensis,Xanthogaleruca luteola,Midgut epithelium,NA,Midgut epithelium,NA,NA,NA
Schroedera airthreyi,"Development and Molecular Characterisation of the Microsporidian Schroedera airthreyi n. sp. in a Freshwater Bryozoan Plumatella sp. (Bryozoa: Phylactolaemata). Abstract. The development of a new species of microsporidian, infecting a freshwater Plumatellid bryozoan, is described. The small-subunit rDNA, internal transcribed spacer region (ITS), and partial large-subunit rDNA genes were sequenced. Phylogenetic analysis demonstrated that the parasite clustered with Schroedera plumatellae. However, while there were morphological affinities with this species, significant differences were also observed. The infection initially appeared as a roughening of the peritoneum lining the metacoelom of the bryozoan. This roughening resolved into meront-infected syncytia, composed of interconnected cells of the body wall that detached to float in the coleomic cavity. Spores were observed to develop within these syncytia. All stages of development were diplokaryotic in contrast to S. plumatellae, which has a distinct monokaryotic merogony preceding sporogony. The infection was pathogenic to the host. Direct bryozoan–bryozoan transmission was not observed. We propose to name the microsporidian Schroedera aithreyi n. sp.",Schroedera airthreyi,Plumatella sp.,muscle,NA,muscle,NA,peritoneum,NA
Schroedera plumatellae,"Development of Schroedera plumatellae gen. n., sp. n. (Microsporidia) in Plumatella fungosa (Bryozoa: Phylactolaemata). A new microsporidian, Schroedera plumatellae, is described infecting a freshwater bryozoan. The development of the infection is described both at the light and ultrastructural level. The infection induces the formation of hyperplastic testes within the bryozoan host from which cord-like xenomas form. Development of diplokaryotic sporonts is preceded by haplophasic schizogony. Sporogony forms diplokaryotic spores. The spores formed within the xenomas are oval, tapering to one end and were 7.2 ± 0.3 μm by 5.0 ± 0.3 μm with 22-23 turns of the polar filament. Sporogony occurred within the hyaloplasm with the exospore developing into two distinct layers. Phylogenetic analysis showed that the parasite was most closely related to a Bacillidium sp. and Janacekia debaisieuxi.",Schroedera plumatellae,Plumatella fungosa,spermatogonia,NA,spermatogonia,NA,testes,NA
