species,title_abstract,species_corrected,hosts_corrected,infection_site,infection_site_parenthesized,infection_site_not_in_text,parenthesized_not_in_text,infection_site_corrected,parenthesized_corrected
Lotmaria passim,"Characterization of Two Species of Trypanosomatidae from the Honey Bee Apis mellifera: Crithidia mellificae Langridge and McGhee, and Lotmaria passim n. gen., n. sp.. Trypanosomatids are increasingly recognized as prevalent in European honey bees (Apis mellifera) and by default are attributed to one recognized species, Crithidia mellificae Langridge and McGhee, 1967. We provide reference genetic and ultrastructural data for type isolates of C. mellificae (ATCC 30254 and 30862) in comparison with two recent isolates from A. mellifera (BRL and SF). Phylogenetics unambiguously identify strains BRL/SF as a novel taxonomic unit distinct from C. mellificae strains 30254/30862 and assign all four strains as lineages of a novel clade within the subfamily Leishmaniinae. In vivo analyses show strains BRL/SF preferably colonize the hindgut, lining the lumen as adherent spheroids in a manner identical to previous descriptions from C. mellificae. Microscopy images show motile forms of C. mellificae are distinct from strains BRL/SF. We propose the binomial Lotmaria passim n. gen., n. sp. for this previously undescribed taxon. Analyses of new and previously accessioned genetic data show C. mellificae is still extant in bee populations, however, L. passim n. gen., n. sp. is currently the predominant trypanosomatid in A. mellifera globally. Our findings require that previous reports of C. mellificae be reconsidered and that subsequent trypanosomatid species designations from Hymenoptera provide genetic support.",Lotmaria passim,Apis mellifera,ileum,NA,ileum,NA,NA,NA
Merocinta davidii,"Ultrastructure and life cycle of Merocinta davidii gen et sp. nov, a dimorphic microsporidian parasite of Mansonia africana (Diptera: Culicidae) from Tanzania. Mansonia africana larvae were sampled at three sites in NE Tanzania, between June and September 1987. At each site between 2.5 and 5.7% were infected with a multisporous microsporidian parasite. The ovoid spores measured 2.5 × 1.5 •m. Meronts were diplokaryotic with electron-dense, thickened unit membranes. Repeated division of the diplokarya gave rise to multinucleate plasmodia, the plasma membrane of which was entirely surrounded by two other membranes interpreted as host endoplasmic reticulum. Both membranes were studded with ribosomes. Meronts became ribbon-like before division, the endoplasmic reticulum dividing with the parasite. At the onset of sporogony the two nuclei of the diplokaryon separated and the electron-dense coat was sloughed off. Nuclear division and cytoplasmic division gave rise to uninucleate sporoblasts and spores. Adult M. africana collected at one of the three sites were infected with two diplokaryotic microsporidia, designated Type A and Type B, which differed only in the size of the spores. Spores of Type A measured 3.4 ×1.8 •m and those of Type B measured 6.6 × 2.9 •m; both types were binucleate. Type A infected 10.8 and Type B 5.8% of the adults collected. Mixed infections were not observed. In transovarial transmission trials, larvae were not successfully reared from adults infected with Type B. However, 11.3% of progeny from females infected with Type A exhibited multisporous microsporidian infections indistinguishable from those found in larvae collected at that site, showing that the multisporous parasite in larvae and the Type A infection of adults represent different stages in the life cycle of a single species. The morphology and life cycle of this microsporidian exclude it from all other related genera and it is attributed here to a new genus and given the name Merocinta davidii.",Merocinta davidii,Mansonia africana,midgut; ovary,NA,midgut; ovary,NA,NA,NA
Microsporidium aedium,"Microsporidium aedium n. sp., from the mosquito Aedes cantans",Microsporidium aedium,Aedes cantans,gastric caeca,NA,gastric caeca,NA,NA,NA
Microsporidium aplysiae,"Spores of a New Microsporidan Species Parasitizing Molluscan Neurons. A new species of Microsporida was observed in neurons of the marine mollusc Aplysia californica and the ultrastructure of its spores was investigated. The spores were 1.3 mm long and had a thick 3‐layered coat. An anchoring disc and polar aperture were present. The polaroplast occupied most of the anterior half of the spore. The vesicular portion included lengths of loosely packed lamellar structures as well as the usual vesicular profiles embedded in fibrillar material; it was entirely surrounded by tightly packed, electron‐dense lamellae. The polar tube had 5 or 6 coils. In this stage of the life cycle (mature spores), the parasites did not appear to be disturbing the host cells. The organism was named Microsporidium aplysiae sp. n.",Microsporidium aplysiae,Aplysia californica,neurons,abdominal ganglia,NA,abdominal ganglia,NA,NA
Microsporidium aurata,"Morphological and phylogenetic description of a new xenoma-inducing microsporidian, Microsporidium aurata nov. sp., parasite of the gilthead seabream Sparus aurata from the Red Sea. A new species of Microsporidia found in the marine teleost Sparus aurata collected from Hurghada coasts along the Red Sea, Egypt was described based on light and ultrastructural studies. Twenty three (30.6 %) out of 75 of the examined fish were parasitized with a microsporidian parasite. Numerous macroscopic whitish cysts embedded in the peritoneal cavity were observed to infect many organs of the body including muscles, connective tissues, and the intestinal epithelium. The infection was developed as tumor-like masses of often up to 5 mm in diameter inducing an enormous hypertrophy to the infected organs. Fresh spores appeared mostly ovoid to pyriform in shape reaching a size of 1.7 ± 0.5 (1.5–2.5) μm × 1.3 ± 0.4 (1–2) μm; they possessed a large vacuole at the posterior end. These spores were located within a sporophorous vesicle which was bound by a thick amorphous wall. The ultrastructural features support the placement of the present species within the genus Microsporidium. The developmental stages were enclosed within a xenoma structure that was bounded by a double-layered cyst wall. The life cycle of the microsporidian pathogen described herein included four stages: proliferation (merogony), sporogony, sporoblast, spores, and liberation. Mature spores appeared electron dense, uninucleate, and were ellipsoidal in shape. At the anterior end of the spore, the anchoring disk was found in a central position. There was a definite number (5–11) of turns of the polar tube. A 538-bp region of the SSU rDNA gene of the studied species was sequenced (GenBank accession number: KF0220444). Multiple sequence alignment calculated a high degree of similarity (>92 %) with six microsporidian species. The most closely related sequence was provided by the GenBank entry AF151529 for Microsporidium prosopium isolated from Hyperoplus lanceolatus differing in 67 nucleotide positions in its SSU rDNA with the highest percentage of identity (97.2 %) and the lowest divergence value (0.20). Variations in the morphology of the spores and developmental stages between the two species revealed that the two species are different. The site of infection in the host and description of the onset of parasite development are strong criteria for the placement of the microsporidian parasite of the fish S. aurata within the genus Microsporidium as a new species, and we propose to name it Microsporidium aurata nov. sp.",Microsporidium aurata,Sparus aurata,general infection; muscles; connective tissues; and the intestinal epithelium,NA,general infection,NA,NA,NA
Microsporidium cerebralis,Microsporidian encephalitis of farmed Atlantic salmon (Salmo salar) in British Columbia,NA,Salmo salar,brain; motor neurons,NA,brain; motor neurons,NA,NA,NA
Microsporidium ceylonensis,"Some ultrastructural data on Microsporidium ceylonensis, a cause of corneal microsporidiosis. Sections of corneal tissue infected with Microsporidium ceylonensis were restained or processed for electron microscopy. Confirmation was obtained that the parasite develops in macrophages and that spores are uninucleate. New information is provided that sporoblasts and spores develop synchronously within a membrane in the host cell, spores have an anisofilar polar tube of 6-10 wide coils and 2-3 narrow coils and details are given of the spore wall and internal organisation. The parasite was compared on the one hand with Encephalitozoon, which exhibits asynchronous intravacuolar development of merogonic and sporogonic stages and has spores with isofilar polar tubes and on the other hand with species reported from mammals, of which the sporogonic stages develop synchronously within sporophorous vesicles and the spores have anisofilar polar tubes. Even so, a generic emplacement could not be established. Attention is drawn to the similarities between M. ceylonensis and Nosema sp. described from the cornea of a woman in Botswana.",Microsporidium ceylonensis,NA,eye cornea; macrophages,NA,eye cornea,NA,corneal tissue,NA
Microsporidium chloroscombri,"Preliminary Observations on a Microsporidian Parasite of Chloroscombrus Chrysurus Linnaeus, 1776 (Teleost Fish)",NA,Chloroscombrus chrysurus,liver,NA,liver,NA,NA,NA
Microsporidium epithelialis,"Electron microscopic study of a new microsporean Microsporidium epithelialis sp. n. infecting Tubifex sp. (Oligochaeta). The cytology of a new microsporean parasite Microsporidium epithelialis sp. n. from the intestinal epithelial cells of the freshwater oligochaete Tubifex sp. (Tubificidae) is described. The microsporean occurred together with an actinosporean of the genus Triactinomyxon, which was found between the epithelial cells. The merogonic and sporogonic stages (mature spores included) of the microsporean parasite are monokaryotic. An individual sporophorous vesicle surrounds each spore. The fixed and stained spore has an average dimension of 1.9-2.5 x 0.9-1.2 microm. The spores are oval with a characteristic surface layer, showing ornamentation-like projections, which are in close contact to the exospore. A short polar filament forming three to four coils traverses the polaroplast with two lamellar layers. The ultrastructure and other characteristic features of this microsporean parasite are distinct from those of the microsporean species described so far from oligochaetes.",Microsporidium epithelialis,Tubifex sp.,intestinal epithelium,NA,intestinal epithelium,NA,intestinal epithelial cells,NA
Microsporidium fimbriatum,"A New Microsporidian Parasite of the Mosquito Aedes Taeniorhynchus. A new species of microsporidium is described from the mosquito Aedes taeniorhynchus. This microsporidium is vertically transmitted and exhibits dimorphic development with one sequence leading to formation of short pyriform, uninucleate spores in male fourth instar larvae, pupae, and adults, and the other sequence leading to formation of diplocaryotic stages and cylindrical spores in adult females. Vertical transmission is apparently limited to a single generation, and the uninucleate spores are not transmissible per os to larvae.",NA,Aedes taeniorhynchus,fat body; egg,NA,fat body; egg,NA,NA,NA
Microsporidium lesiodermi,"Studies on Histopathology and Development of a Microsporan, Microsporidium lesiodermi, sp. n., from a Coleopteran Insect, Lesioderma sericorne (L.) Infesting Common Spice, Coriandrum sativum (L.). Observations were made on the development of Microsporidium lesiodermi sp. nov. described from Lasioderma serricorne (Coleoptera, Curculionidae) collected from a grain warehouse at Chandannagore, West Bengal, India. The parasite causes general infection in the host and this ultimately leads to mortality. Schizonts are multinucleated and the nuclei are diplokaryotic. Each sporogonial plasmodium contains 10-12 single nuclei. Most spores are macrospores, 3.6-5.3 (4.4) µm × 1.3-3.6 (3.0) µm, but a small number of sporophorous vesicles contain microspores, 1.6-3.3 (2.2) µm × 0.8-1.6 (1.4) µm. Both the spore types possess a single nucleus in the middle and a vacuole at the posterior region. The polar filament is thin and 25-30 µm long.",Microsporidium lesiodermi,Lesioderma sericorne,fat body; hemoctye; midgut epithelium,NA,fat body; hemoctye; midgut epithelium,NA,NA,NA
Microsporidium phoronidi,"A Microsporidian Infection in Phoronids (Phylum Phoronida): Microsporidium phoronidi n. sp. from a Phoronis embryolabi. Abstract Microsporidia‐like spores (2.0–3.0 × 1.3–1.5 μm) were discovered upon examination of histological sections taken from Phoronis embryolabi Temereva, Chichvarkhin 2017 found inhabiting burrows of shrimps Nihonotrypeae japonica (Decapoda, Callianassidae) from the Sea of Japan, Russia. Ultrastructural examination of spores revealed one nucleus and a uniform polar filament of 7–11 coils. Representatives of the phylum Phoronida have never been recorded as hosts of microsporidia. Parasites developed in vasoperitoneal tissue and caused formation of multinucleate syncytia. Basing on unique host and fine morphology, we assign the novel finding to Microsporidium phoronidi n. sp. and place provisionally in the collective genus Microsporidium.",Microsporidium phoronidi,Phoronis embryolab,Vasoperitoneal tissue surrounding embryos,NA,Vasoperitoneal tissue surrounding embryos,NA,vasoperitoneal tissue,NA
Microsporidium phytoseiuli,"Ultrastructure and Pathology of Microsporidium phytoseiulin. sp. Infecting the Predatory Mite, Phytoseiulus persimilis Athias-Henriot (Acari: Phytoseiidae). Ultrastructure and pathology of Microsporidium phytoseiuli n. sp. infecting the predatory mite Phytoseiulus persimilis Athias-Henriot is described using light and transmission electron microscopy. Infected mites showed no gross, external symptoms. All observed stages of the parasite had unpaired nuclei. Schizonts were commonly observed within nuclei of digestive cells of the ventriculus and within the cytoplasm of cells lining the cecal wall and in muscle tissue underlying it. Sporoblasts and spores occurred in the nuclei and cytoplasm of digestive cells within the ventriculus, in cortical regions of the sub- and supraesophageal ganglia, within the cecal wall and muscle tissue, and in parenchyma cells underlying the cuticle. Mature spores were also observed in developing eggs within gravid females. These were broad-to elongate-ovoid, measured 4.33 ± 0.35 × 1.27 ± 0.15 μm (electron micrographs), 5.37 ± 0.46 × 2.22 ± 0.17 μm (fixed and stained), and 5.88 ± 0.34 × 2.22 ± 0.19 μm (fresh) and had an isolfilar polar filament coiled 12 to 15 times within the posterior two-thirds. Within cells, individual spores appeared to be in direct contact with host cytoplasm, while groups of spores were infrequently observed within interfacial envelopes. Groups of 4, 8, to more than 16 spores were observed by light microscopy, while 8 was the maximum observed by electron microscopy. No spores were observed in Tetranychus urticae, a mite used as food during this study.",Microsporidium phytoseiuli,Phytoseiulus persimilis,cortical region of supraesophageal ganglia; cortical region of subesophageal hanglia; muscles; paranchyma; ventriculus digestive cells; cecal wall; developing eggs,NA,cortical region of supraesophageal ganglia; cortical region of subesophageal hanglia; muscles; paranchyma; ventriculus digestive cells,NA,Ventriculus; muscle tissue; parenchyma cells; cuticle,NA
Microsporidium rhabdophilum,"Microsporidium rhabdophilum sp. n. (Microsporida: Pansporoblastina), a parasite of the nematode, Rhabditis myriophila (Rhabditina: Rhabditidae).. Microsporidium rhabdophilum sp. n. (Microsporida : Pansporoblastina) is described from the microbotrophic nematode Rhabditis mny-iophila Poinar. This microsporidian normally infects the hypodermal and reproductive tissues of the nematode. The parasite possessess mall uninucleate, bacilliform sporesp roduced in pansporoblasts.T he number of sporesp er pansporoblast is norrmally 8 or 16 but cari range from 4 to 25. The developmental stages of the parasite are examined ultrastructurally.",Microsporidium rhabdophilum,Rhabditis myriophila,pharyngeal glands; hypodermis; tissues around basal bulb; uterus; oviduct; ovotestis; intestine,wall,pharyngeal glands; hypodermis; tissues around basal bulb; uterus; oviduct; ovotestis; intestine,wall,Hypodermal; reproductive tissues,NA
Microsporidium sitophili,"First Record of Microsporan Infection on Sitophilus oryzae (L.) in India. A species of microsporan, Microsporidium sitophili from a coleopteran stored-grain pest, Sitophilus oryzae is proposed in this communication.",Microsporidium sitophili,Sitophilus oryzae,Malpighian tubules; fat body,NA,Malpighian tubules; fat body,NA,NA,NA
Microsporidium sp.,"Microsporidia of Branchiopods from the Northern regions of Ukraine. Four species of Microsporidia parasitizing Branchiopod hosts are described based on the light and ultrastructural data. Microsporidium sp. from the body cavity of Lepidurus apus, produced ovoid spores 3.5±0.4×2.2±0.3 μm in size. Mononuclear (asymmetrical spores of Larssonia hiberna sp. n., measured 3.8±0.1×2.0±0.2 μm, were found in fat tissues and hemocoel of Daphnia magna. Filamentous episporal surfacing inverted polaroplast and 8-9 coiled isofilar polar filament are characteristic features of this species. Berwaldia singularis Larsson and Microsporidium stagnalis sp. n. from D. pulex are presented. Ellipsoidal spores of M. stagnalis, 4.8±0.4×2.4±0.3 μm in sizes, formed a two-layered exospore, tripartite lamellar and tubular polaroplast, and the isofilar polar filament coiled in a two-layer spiral of 14 rings.",Microsporidium sp.,Lepidurus apus,tissues in protocephalic area; body cavity,NA,tissues in protocephalic area,NA,body cavity,NA
Microsporidium stagnalis,"Microsporidia of Branchiopods from the Northern regions of Ukraine. Four species of Microsporidia parasitizing Branchiopod hosts are described based on the light and ultrastructural data. Microsporidium sp. from the body cavity of Lepidurus apus, produced ovoid spores 3.5±0.4×2.2±0.3 μm in size. Mononuclear (asymmetrical spores of Larssonia hiberna sp. n., measured 3.8±0.1×2.0±0.2 μm, were found in fat tissues and hemocoel of Daphnia magna. Filamentous episporal surfacing inverted polaroplast and 8-9 coiled isofilar polar filament are characteristic features of this species. Berwaldia singularis Larsson and Microsporidium stagnalis sp. n. from D. pulex are presented. Ellipsoidal spores of M. stagnalis, 4.8±0.4×2.4±0.3 μm in sizes, formed a two-layered exospore, tripartite lamellar and tubular polaroplast, and the isofilar polar filament coiled in a two-layer spiral of 14 rings.",Microsporidium stagnalis,Daphnia pulex,hematocoel; adipose tissue,NA,hematocoel; adipose tissue,NA,NA,NA
Mockfordia xanthocaeciliae,"New microsporidia parasitizing bark lice (Insecta: Psocoptera). Abstract Two species of bark lice, Xanthocaecilius sommermanae Mockford and Polypsocus corruptus Hagen, collected in a canopy Malaise trap placed in Great Smoky Mountains National Park as part of a survey of the park’s fauna, were found to be infected with microsporidia. Diagnosis was originally based on light microscopy, and was confirmed by PCR amplification and electron microscopy. This is the first record of microsporidia infection in the insect order Psocoptera. Four morphological spore types corresponded to four original SSUrDNA sequences (Genbank accession no. FJ865221-24), suggesting infection with four microsporidia species. Two of those species were examined by electron microscopy. We describe here one new genus and two new species based on morphological and sequence data: Antonospora psocopterae sp. n. with elongated diplokaryotic spores, 4.4±0.05×1.9±0.03μm and Mockfordia xanthocaeciliae gen. n. sp. n. with ovocylindrical monokaryotic spores, 2.5±0.10×1.4±0.02μm. A. psocopterae displayed high sequence (95%) and structural similarity with Antonospora scoticae, fell within a well supported dichotomy with A. scoticae inside the Antonospora–Paranosema clade in phylogenetic analyses by NJ, PS and ML. M. xanthocaeciliae did not exhibit much sequence or structural similarity with any of known microsporidia species, except Encephalitozoon spp. M. xanthocaeciliae fell within one clade with Encephalitozoon spp. in phylogenies and shared with encephalitozoons structural resemblance and about 80% of SSUrDNA sequence identity. The other two species were not described and provisionally were placed to the collective genus Microsporidium as Microsporidium sp. 1 and Microsporidium sp. 4 from bark lice because of insufficient morphological data. The finding that samples fixed and stored for months in propylene glycol (“antifreeze”) are good enough for DNA sequence analysis and can be used for morphological analyses (if no better fixation alternatives are available), is promising for future surveys for microsporidia.",Mockfordia xanthocaeciliae,Xanthocaecilius sommermanae; Polypsocus corruptus,Muscles,NA,Muscles,NA,NA,NA
Mrazekia macrocyclopis,"Ultrastructure and molecular phylogeny of Mrazekia macrocyclopis sp. n. (Microsporidia, Mrazekiidae), a microsporidian parasite of Macrocyclops albidus (Jur.) (Crustacea, Copepoda). The ultrastructure and molecular phylogeny of a new microsporidium Mrazekia macrocyclopis sp.n., a parasite of the copepod Macrocyclops albidus (Jur.) in North-West of Russia are described. All stages of its life cycle are diplokaryotic. Fresh spores are rod-shaped and 7.3-10.5 × 1.6-2.3 μm in size. Spore ultrastructure is typical of Mrazekia. The polar tube consists of the anterior clavate manubrium followed by a thin filament arranged in 3.5-4.5 nearly vertical coils. Spores are enclosed in individual sporophorous vesicles. SSU rDNA sequence analysis showed attribution of the new species to a cluster of microsporidia infecting insects (Cystosporogenes, Endoreticulatus), microsrustaceans (Glugoides), vertebrates (Vittaforma) and ciliates (Euplotespora) nested within the clade IV sensu Vossbrinck, Debrunner-Vossbrinck (2005). Mrazekia macrocyclopis is not therefore closely related to Bacillidium vesiculoformis, another microsporidium with rod-shaped spores, and the polyphyletic nature of the family of Mrazekiidae is obvious.",Mrazekia macrocyclopis,Macrocyclops albidus,Adipose,NA,Adipose,NA,NA,NA
Mutated Thelohaniidae sp.,Unusual polar filament structure in two Microsporidia from water reservoirs with radionuclide and organic pollution. Two species of microsporidia with an unusual polar filament structure were found in Cricotopus silvestris and Microtendipes pedellus larvae which were collected near the zone of influence of the Chernobyl atomic power station (Ukraine) and from a high polluted pond in the Mazurian region of Poland. The first microsporidium has separate unikaryotic spores and was assigned to the family Unikaryonidae Sprague. The diameter of the middle coil of the triple-coiled polar filament of this microsporidium was larger than its two other coils. The observed polar filament was thus neither of isofilar nor of the classical anisofilar type. The second polysporoblastic microsporidium has unikaryotic spores and an uncoiled polar filament and was placed in the family Thelohaniidae Hazard and Oldacre. The rare single macrospores of this microsporidium have a double set of the polar filament complex. The relationship between ultrastructural features of microsporidian spores and water pollution is discussed.,NA,Microtendipes pedellus,fat body,NA,fat body,NA,NA,NA
Mutated Unikaryonidae sp.,Unusual polar filament structure in two Microsporidia from water reservoirs with radionuclide and organic pollution. Two species of microsporidia with an unusual polar filament structure were found in Cricotopus silvestris and Microtendipes pedellus larvae which were collected near the zone of influence of the Chernobyl atomic power station (Ukraine) and from a high polluted pond in the Mazurian region of Poland. The first microsporidium has separate unikaryotic spores and was assigned to the family Unikaryonidae Sprague. The diameter of the middle coil of the triple-coiled polar filament of this microsporidium was larger than its two other coils. The observed polar filament was thus neither of isofilar nor of the classical anisofilar type. The second polysporoblastic microsporidium has unikaryotic spores and an uncoiled polar filament and was placed in the family Thelohaniidae Hazard and Oldacre. The rare single macrospores of this microsporidium have a double set of the polar filament complex. The relationship between ultrastructural features of microsporidian spores and water pollution is discussed.,NA,Cricotopus silvestris,Malpighian tubules,NA,Malpighian tubules,NA,NA,NA
