species,title_abstract,species_corrected,hosts_corrected,infection_site,infection_site_parenthesized,infection_site_not_in_text,parenthesized_not_in_text,infection_site_corrected,parenthesized_corrected
Ciliatosporidium platyophryae,"Ciliatosporidium platyophryae nov. gen., nov. spec. (Microspora incerta sedis), a parasite of Platyophrya terricola (Ciliophora, Colpodea). Ciliatosporidium platyophryae nov. gen., nov. spec, is a microsporidian parasite affecting the soil ciliate Cirrophrya terricola Foissner, 1987. It was found in a soil sample from Utah (USA), pure cultures were not available. The developmental stages seen are uninucleate and divide by binary fission (disporoblastic). Each sporont is enveloped by a membranelike exospore precursor and a parasitophorous vacuole deriving from host endoplasmic reticulum and persisting during spore maturation. The spore is rod-shaped with hemispherical ends and measures about 4×2 μm. It has a short, uncoiled polar filament and conspicuous, possibly transient sacs in the wide anterior lamellae of the bipartite polaroplast. The exospore has the appearance of a unit membrane. Maturing spores induce the formation of appendages (“feet”) at the posterior end of the host which was thus formerly assigned to the genus Cirrophrya. However, our study shows that the feet are a pathological phenomenon and the host thus belongs to the genus Platyophrya: Platyophrya terricola (Foissner, 1987) nov. comb. Despite its unusual host, the fine structure of C. platyophryae is very similar to that of microsporidia from other invertebrate and vertebrate hosts. Very likely, C. platyophryae is related to the genera Oligosporidium, Encephalitozoon, Unikaryon and Endoreticulatus, presently assigned to the families Encephalitozoonidae and/or Unikaryonidae. However, for a definite classification of C. platyophryae more detailed data on its life cycle and membranous envelopes are necessary. Thus, we prefer an incerta sedis position.",Ciliatosporidium platyophryae,Cirrophrya terricola,posterior body; appendages,NA,posterior body,NA,NA,NA
Cristulospora aedis,"A new genus of microsporidans Cristulospora gen. n. (Amblyospiridae) with 3 new species from blood-sucking mosquitoes in Uzbekistan. Three new species of microsporidans of the new genus Cristulospora are described from mosquitoes of the genera Culex and Aedes (floodlands of the Syr Darya, Syrdarya Province, Bukharskiĭ oasis). In mosquitoes microsporidans have sporogony of two types that is characteristic of the family Amblyosporidae. The development in larvae ends in the formation of 8 uninucleate spores in pansporoblasts. In females single binucleate spores are formed. The new genus differs from other amblyosporids in the presence of appendages in shape of magnificent plumes on both poles of octospores, which are distinct without staining. C. sherbani sp. n. from Culex modestus forms spores measuring 5.0-8.1 X 4.3-5.6 microns in larvae. During the fixation the poles become flattened, plumes are equal, most of them having wide bases. In genital ducts of females oval cylindrical thin-walled spores of 6.3-8.7 X 2.5-3.7 microns are formed. C. cadyrovi sp. n. from Culex pipiens forms spores of 5.6-6.8 X 3.7-5.0 microns in larvae. After the fixation the poles do not become flattened, plumes are equal, with narrow base. The second type of spores has not been discovered. C. aedis sp. n. from Aedes caspius has spores of 6.2-7.5 X 4.3-5.6 microns in larvae. Plumes with narrow base, the anterior and posterior ones are different in shape. In genital ducts of females thin-walled spores of 8.7-11.8 X 3.7-5.0 microns are formed.",Cristulospora aedis,Aedes caspius,genital ducts; fat body,NA,fat body,NA,NA,NA
Cristulospora cadyrovi,"A new genus of microsporidans Cristulospora gen. n. (Amblyospiridae) with 3 new species from blood-sucking mosquitoes in Uzbekistan. Three new species of microsporidans of the new genus Cristulospora are described from mosquitoes of the genera Culex and Aedes (floodlands of the Syr Darya, Syrdarya Province, Bukharskiĭ oasis). In mosquitoes microsporidans have sporogony of two types that is characteristic of the family Amblyosporidae. The development in larvae ends in the formation of 8 uninucleate spores in pansporoblasts. In females single binucleate spores are formed. The new genus differs from other amblyosporids in the presence of appendages in shape of magnificent plumes on both poles of octospores, which are distinct without staining. C. sherbani sp. n. from Culex modestus forms spores measuring 5.0-8.1 X 4.3-5.6 microns in larvae. During the fixation the poles become flattened, plumes are equal, most of them having wide bases. In genital ducts of females oval cylindrical thin-walled spores of 6.3-8.7 X 2.5-3.7 microns are formed. C. cadyrovi sp. n. from Culex pipiens forms spores of 5.6-6.8 X 3.7-5.0 microns in larvae. After the fixation the poles do not become flattened, plumes are equal, with narrow base. The second type of spores has not been discovered. C. aedis sp. n. from Aedes caspius has spores of 6.2-7.5 X 4.3-5.6 microns in larvae. Plumes with narrow base, the anterior and posterior ones are different in shape. In genital ducts of females thin-walled spores of 8.7-11.8 X 3.7-5.0 microns are formed.",Cristulospora cadyrovi,Culex pipiens,fat body,NA,fat body,NA,NA,NA
Cristulospora sherbani,"A new genus of microsporidans Cristulospora gen. n. (Amblyospiridae) with 3 new species from blood-sucking mosquitoes in Uzbekistan. Three new species of microsporidans of the new genus Cristulospora are described from mosquitoes of the genera Culex and Aedes (floodlands of the Syr Darya, Syrdarya Province, Bukharskiĭ oasis). In mosquitoes microsporidans have sporogony of two types that is characteristic of the family Amblyosporidae. The development in larvae ends in the formation of 8 uninucleate spores in pansporoblasts. In females single binucleate spores are formed. The new genus differs from other amblyosporids in the presence of appendages in shape of magnificent plumes on both poles of octospores, which are distinct without staining. C. sherbani sp. n. from Culex modestus forms spores measuring 5.0-8.1 X 4.3-5.6 microns in larvae. During the fixation the poles become flattened, plumes are equal, most of them having wide bases. In genital ducts of females oval cylindrical thin-walled spores of 6.3-8.7 X 2.5-3.7 microns are formed. C. cadyrovi sp. n. from Culex pipiens forms spores of 5.6-6.8 X 3.7-5.0 microns in larvae. After the fixation the poles do not become flattened, plumes are equal, with narrow base. The second type of spores has not been discovered. C. aedis sp. n. from Aedes caspius has spores of 6.2-7.5 X 4.3-5.6 microns in larvae. Plumes with narrow base, the anterior and posterior ones are different in shape. In genital ducts of females thin-walled spores of 8.7-11.8 X 3.7-5.0 microns are formed.",Cristulospora sherbani,Culex modestus,genital ducts; fat body,NA,fat body,NA,NA,NA
Cucumispora dikerogammari (1),"New data on microsporidium Nosema dikerogammari. Ultrastructures of the microsporidium Nosema dikerogammari, the parasite of amphipods Dikerogammaris villosus, Chaetogammarus ischnus, and Pontogammarus crassus in Ukraine, are described. The diplocaryotic meronts, sporonts and spores, the lamellar polaroplast, the isofilar polar filament puck up to 7-8 coils with different angles, are the characteristics of N. dikerogammari.",Nosema dikerogammari,Chaetogammarus ischnus; Pontogammarus crassus; Dikerogammaris villosus,Primarily muscle cells; somatic tissue; adipose tissue; haemolymph; gonads,secondarily; secondarily,Primarily muscle cells; somatic tissue; adipose tissue; haemolymph; gonads,secondarily; secondarily,NA,NA
Cucumispora ornata,"Cucumispora ornata n. sp. (Fungi: Microsporidia) infecting invasive ‘demon shrimp’ (Dikerogammarus haemobaphes) in the United Kingdom. Dikerogammarus haemobaphes, the ‘demon shrimp’, is an amphipod native to the Ponto-Caspian region. This species invaded the UK in 2012 and has become widely established. Dikerogammarus haemobaphes has the potential to introduce non-native pathogens into the UK, creating a potential threat to native fauna. This study describes a novel species of microsporidian parasite infecting 72.8% of invasive D. haemobaphes located in the River Trent, UK. The microsporidium infection was systemic throughout the host; mainly targeting the sarcolemma of muscle tissues. Electron microscopy revealed this parasite to be diplokaryotic and have 7–9 turns of the polar filament. The microsporidium is placed into the ‘Cucumispora’ genus based on host histopathology, fine detail parasite ultrastructure, a highly similar life-cycle and SSU rDNA sequence phylogeny. Using this data this novel microsporidian species is named Cucumispora ornata, where ‘ornata’ refers to the external beading present on the mature spore stage of this organism. Alongside a taxonomic discussion, the presence of a novel Cucumispora sp. in the United Kingdom is discussed and related to the potential control of invasive Dikerogammarus spp. in the UK and the health of native species which may come into contact with this parasite.",Cucumispora ornata,Dikerogammarus haemobaphes,muscles; connective tissue; nervous system; carapace,between the gut and gonad,muscles; connective tissue; nervous system; carapace,between the gut and gonad,muscle tissues,NA
Cucumispora roeselii,"Parasites, Pathogens and Commensals in the ‘Low-Impact’ Non-Native Amphipod Host Gammarus Roeselii. BACKGROUND: Whilst vastly understudied, pathogens of non-native species (NNS) are increasingly recognised as important threats to native wildlife. This study builds upon recent recommendations for improved screening for pathogens in NNS by focusing on populations of Gammarus roeselii in Chojna, north-western Poland. At this location, and in other parts of continental Europe, G. roeselii is considered a well-established and relatively 'low-impact' invader, with little understanding about its underlying pathogen profile and even less on potential spill-over of these pathogens to native species. RESULTS: Using a combination of histological, ultrastructural and phylogenetic approaches, we define a pathogen profile for non-native populations of G. roeselii in Poland. This profile comprised acanthocephalans (Polymorphus minutus Goese, 1782 and Pomphorhynchus sp.), digenean trematodes, commensal rotifers, commensal and parasitic ciliated protists, gregarines, microsporidia, a putative rickettsia-like organism, filamentous bacteria and two viral pathogens, the majority of which are previously unknown to science. To demonstrate potential for such pathogenic risks to be characterised from a taxonomic perspective, one of the pathogens, a novel microsporidian, is described based upon its pathology, developmental cycle and SSU rRNA gene phylogeny. The novel microsporidian Cucumispora roeselii n. sp. displayed closest morphological and phylogenetic similarity to two previously described taxa, Cucumispora dikerogammari (Ovcharenko & Kurandina, 1987), and Cucumispora ornata Bojko, Dunn, Stebbing, Ross, Kerr & Stentiford, 2015. CONCLUSIONS: In addition to our discovery extending the host range for the genus Cucumispora Ovcharenko, Bacela, Wilkinson, Ironside, Rigaud & Wattier, 2010 outside of the amphipod host genus Dikerogammarus Stebbing, we reveal significant potential for the co-transfer of (previously unknown) pathogens alongside this host when invading novel locations. This study highlights the importance of pre-invasion screening of low-impact NNS and, provides a means to document and potentially mitigate the additional risks posed by previously unknown pathogens.",Cucumispora roeselii,Gammarus roeselii,muscle,NA,muscle,NA,NA,NA
Cystosporogenes deliaradicae,"Ultrastructural study and description of Cystosporogenes deliaradicae n. sp. (microspora, glugeidae), a microsporidian parasite of the cabbage root fly Delia radicum (Linnaeus, 1758) (diptera, anthomyidae). The microsporidium Cystosporogenes deliaradicae sp. no v., a parasite of the adipose tissue of adult cabbage root flies, Delia radicum in Denmark, is described based on light microscopic and ultrastructural characteristics. All life cycle stages have isolated nuclei. The sporogony is polysporoblastic, yielding 4–16 (most commonly 6 or 8) ovocylindrical spores, measuring 1.2–1.5 × 4.6–5.5 μm when fixed and stained. The spore wall has an approximately 43 nm thick, layered exospore with a median layer resembling a double membrane. The polaroplast is uniformly lamellar. The isofilar, 114–123 nm thick, polar filament is arranged in 11–15 (most commonly 12–13) coils in a single layer close to the spore wall. The angle of tilt is approximately 35°. The last coil touches the posterior pole of the spore. A sporophorous vesicle is produced by the sporont. The envelope is generated as a duplication of the plasma membrane. Typically the vesicle primordia grow from one pole of the sporont to the other. The episporontal space initially has granular inclusions. Later septate, persistent tubules of exospore material appear. Simultaneously with the release of sporoblasts, wide tubulus-like, non-persistent structures are formed. They are covered by regularly spaced electron-dense material. Anomalous sporogony was frequently observed, probably caused by a simultaneous parasitism by the fungus Strongwellsea castrans. The systematic position of the microsporidium is discussed, including the reasons for incorporating the genus into the family Glugeidae",Cystosporogenes deliaradicae,Delia radicum,fat body,close to hypoderm,fat body,close to hypoderm,NA,NA
Cystosporogenes sp.,"Morphology, molecular characteristics and prevalence of a Cystosporogenes species (Microsporidia) isolated from Agrilus anxius (Coleoptera: Buprestidae). A microsporidium was isolated from the bronze birch borer, Agrilus anxius Gory (Coleoptera: Buprestidae), collected near Sudbury and Sault Ste Marie, Canada. Light and electron microscopic investigations showed that gross pathology and ultrastructure of the investigated Cystosporogenes species was similar to those characterized and described for other Cystosporogenes species. Small subunit rRNA gene sequence data and comparative phylogenetic analysis confirmed that the microsporidian species from A. anxius is most closely related to the genus Cystosporogenes clade of microsporidia. Infection average in the Sudbury and Sault Ste Marie beetle populations was >80% and relatively stable in 2006–2007 but declined in 2008. Field prevalence of the A. anxius isolate, mechanisms that may potentially be involved in its horizontal (autoinfection) and vertical (transovarial) transmission, and disease dynamics are discussed. The congeneric relationship between Agrilus planipennis and A. anxius makes it imperative to study the virulence of this Cystosporogenes species in A. Planipennis.",Cystosporogenes species,Agrilus anxius,Fat body; gut epithelium,NA,Fat body; gut epithelium,NA,NA,NA
Desmozoon lepeophtherii (also Paranucleospora theridion) (1),"A hyperparasitic microsporidian infecting the salmon louse, Lepeophtheirus salmonis: an rDNA-based molecular phylogenetic study. The sea louse, Lepeophtheirus salmonis, is an obligate ectoparasitic copepod that lives on the external surface of salmonid fish. It is the most common ectoparasite of marine cage-reared salmonids, causing major economic loss to the aquaculture industry. During a sea louse monitoring programme, samples of L. salmonis were found to harbour an unreported microsporidian parasite. The microsporidian was observed in pre-adult and adult stages of both male and female copepods, with a prevalence of up to 5%. Unfixed spores were slightly pyriform in shape measuring 2.34 μm by 1.83 μm (±0.01 μm) and were not observed to be enclosed by a sporophorous vesicle. The microsporidian infection was observed in all areas of the copepods’ body, xenoma-like cysts forming directly under the cuticle in the epidermal tissue layer. In the present study, rDNA (530f–580r) sequence data gathered from the unidentified microsporidian parasite isolated from infected sea lice were compared with equivalents available in the databases in an attempt to identify its systematic position. The microsporidian was found to group within the phylogenetic clade containing the family Enterocytozoonidae, being most similar to members of the intranuclear genus Nucleospora. This is the first report of a hyperparasitic microsporidian infecting a caligid copepod.",NA,Lepeophtheirus salmonis,epithelium; endothelium; connective; haemocytes,NA,epithelium; endothelium; connective; haemocytes,NA,epidermal tissue layer,NA
Dictyocoela diporeiae,"Molecular and ultrastructural characterization of Dictyocoela diporeiae n. sp. (Microsporidia), a parasite of Diporeia spp. (Amphipoda, Gammaridea). Dictyocoela diporeiae n. sp. is described from Diporeia spp. (Amphipoda, Gammaridea) collected from Lake Superior (USA), and its morphology and taxonomic affiliation are discussed. In hematoxylin- and eosin-stained sections of infected amphipods, the microsporidian was observed to infect muscle tissue surrounding the ovaries. Melanized hemocytic encapsulations were often observed in or near masses of microsporidians. The microsporidians appeared as spores measuring 1.99 ± 0.09 μm long by 1.19 ± 0.05 μm wide. Each spore contained eight coils of isofilar polar filaments that were arranged in single ranks. Polar filaments measured 71 ± 3 nm in diameter. A prominent lamellar polaroplast composed of ordered concentric membranes was found at the apical end of the spore surrounding the polar filament. A distinct posterior vacuole was observed at the distal end of the spore. Phylogenetic analysis based on 16s RNA sequences showed that the microsporidian belongs to the genus Dictyocoela, and is most similar to D. berillonum, yet distinctly different. The species is new, based on its morphology, genetic sequence, host, and location within the host.",Dictyocoela diporeiae,Amphipoda; Gammaridea; Diporeia spp.,Muscle surrounding ovaries,NA,Muscle surrounding ovaries,NA,muscle tissues (Diporeia spp.),NA
Dictyocoela duebenum (1),"Infection of Gammarus duebeni populations by two vertically transmitted microsporidia; parasite detection and discrimination by PCR-RFLP. We screened a population of the brackish water crustacean Gammarus duebeni from the Isle of Cumbrae for the presence of vertically transmitted microsporidia. We compared 2 screening techniques; light microscopy and PCR-based detection using generic 16S rDNA microsporidian primers. Fifty percent of females from this population tested positive for vertically transmitted microsporidia. The PCR screen was 100% efficient in comparison with existing LM based screening. In addition, the PCR screen produced bands of 2 sizes suggesting that more than 1 species of microsporidian was present. Sequencing revealed 2 distinct species of vertically transmitted microsporidia; 33% of females were infected with the feminizer Nosema granulosis and 17% were infected with a new species which we provisionally designate Microsporidium sp. On the basis of sequence information, we developed a discriminatory PCR-RFLP test based on MspI and HaeIII digests. This screen allows rapid detection and discrimination of vertically transmitted microsporidia in natural field populations. We applied the PCR-RFLP screen to a second G. duebeni population from the Isle of Man. This population also hosted these 2 parasite species. In total 45% of females harboured N. granulosis and 10% harboured Microsporidium sp. No dual-infected individuals were found in either population. The occurrence of 2 vertically transmitted parasites within a population has implications for our understanding of parasite-host relationships in the field and we discuss factors affecting the dynamics of parasite-parasite competition and coexistence.",NA,Gammarus duebeni,egg; ovarian,NA,egg; ovarian,NA,NA,NA
Dictyocoela roeselum (1),"Coexistence of three microsporidia parasites in populations of the freshwater amphipod Gammarus roeseli: evidence for vertical transmission and positive effect on reproduction. We investigated the prevalence, transmission mode and fitness effects of infections by obligatory intracellular, microsporidian parasites in the freshwater amphipod Gammarus roeseli. We found three different microsporidia species in this host, all using transovarial (vertical) transmission. All three coexist at different prevalences in two host populations, but bi-infected individuals were rarely found, suggesting no (or very little) horizontal transmission. It is predicted that vertically-transmitted parasites may exhibit sex-specific virulence in their hosts, or they may have either positive or neutral effects on host fitness. All three species differed in their transmission efficiency and infection intensity and our data suggest that these microsporidia exert sex-specific virulence by feminising male hosts. The patterns of infection we found exhibit convergent evolution with those of another amphipod host, Gammarus duebeni. Interestingly, we found that infected females breed earlier in the reproductive season than uninfected females. This is the first study, to our knowledge, to report a positive effect of microsporidian infection on female host reproduction.",NA,Gammarus roeseli,egg; ovarian,NA,egg; ovarian,NA,NA,NA
Duboscqia dengihilli,"Life cycle of a new species of Duboscqia (Microsporida: Thelohaniidae) infecting the mosquito Anopheles hilli and an intermediate copepod host, Apocyclops dengizicus. A new species of Microsporida, Duboscqia dengihilli, was found infecting larvae of the mosquito Anopheles hilli in northern Queensland, Australia. Laboratory experiments showed that binucleate spores formed within infected female mosquitoes were responsible for transovarial transmission to the next generation. Sporogony within the larval fat body was initiated by two diplokarya, one at each end of the cell, which undergo meiosis within a single sporophorous vesicle to form 16 meiospores. These spores are responsible for horizontal transmission to the copepod Apocyclops dengizicus. The microsporidium is transmitted back to the mosquito host via uninucleate pyriform spores formed within the copepod host which are infectious to larvae of A. hilli. The meronts within larvae infected by horizontal transmission ultimately develop into the binucleate spores within adult females to complete the life cycle. Thus, the development of this microsporidium involves vertical transmission between successive mosquito generations and horizontal transmission between mosquitoes and copepods similar to the life cycles of Amblyospora and Parathelohania.",Duboscqia dengihilli,Anopheles hilli; Apocyclops dengizicus,fat body; oenocytes,NA,oenocytes,NA,fat body (Anopheles hilli),NA
Encephalitozoon hellem (1),"Isolation and characterization of a new human microsporidian, Encephalitozoon hellem (n. sp.), from three AIDS patients with keratoconjunctivitis. A new human microsporidian was isolated from cultures of Madin-Darby canine kidney cells incubated with conjunctival scrapings or corneal tissues from three AIDS patients with keratoconjunctivitis. The three isolates were morphologically similar to Encephalitozoon cuniculi. The spores averaged 1 x 1.5-2.0 microns, had six to eight polar filament coils, displayed monokaryotic nuclei, and possessed relatively thick endospores with irregularly shaped exospores. Organisms developed within a parasitophorous vacuole. By SDS-PAGE analysis, the three isolates appeared to be identical but were different from E. cuniculi. Identical banding patterns on Western blots of the three isolates were expressed by each patient's serum. By Western immunoblotting, murine antisera to E. cuniculi reacted to several antigens of the new AIDS-related microsporidian, whereas murine antisera bound weakly to Nosema corneum. The name Encephalitozoon hellem (n. sp.) is proposed to identify this new human microsporidian.",Encephalitozoon hellem,human,small intestine; liver; kidney; spleen; lung; heart; ventriculus; skeletal muscles; brain; eye cornea; eye conjunctiva,NA,small intestine; liver; spleen; lung; heart; ventriculus; skeletal muscles; brain; eye cornea; eye conjunctiva,NA,NA,NA
